,review
522,love wanted fresh take series make happy give lot meat chew music nice opinion describe lot mystical dreamlike battle themes however seem less varied compared past titles recall different themes throughout main storyline main story less typical filler meaning bare minimum would need call story exists mostly get point characters nice designs ideas concepts peppered throughout caught interest story quite bland lifeless unfortunate surprising always look great even good terms graphics expected something consistently beautiful polished let bulk reasoning review score gameplay depending enjoy open world style games either make break alpha new battle catching system exploration gathering crafting scratch itch feels fluid fun satisfying wander around things tandem world empty side leaves much desired enough keep wanting explore pokedex research put people series competitive aspects lot required certain point people like like relax wander without worrying much building top tier smogon team plowing battle tower going deter enjoying laid back aspects arceus legends important positive step forward series choose keep going way learn mistakes could easily create best ever one day one best open world games ever one day far point legends enjoyed immensely fan years 
523,simultaneously best embarassing thing gamefreak ever released fantastic bundled obviously underdeveloped package pokémon models animations look great world looks like early progress shot would see indie dev share twitter laughable bad looks areas especially caves dark areas background literally warp around character like poorly greenscreened many gripes story pacing lot dialogue scenes either need cut shorter interesting voice acting would helped otherwise honestly fantastic favourite pokémon experience date wish came like year later would development time needed would love style continue iterated major improvement old formula like settlememts explore complex side quests etc would dream also thank god released one version 
524,necessary experiment pokémon franchise executed fairly well importantly think laid solid foundation future sequels build formula focuses entirely single player experience differs games series battling human players minimal interaction others entirely design serves prequel pokémon franchise areas explore empty due underdeveloped definitely gives series long desired sense exploration adventure huge fan pokémon games played several skipped others wasn mood formula changed years welcome change pace still keeping core spirit pokémon universe gameplay loop feels much like early pokémon main objective explore catch pokémon pleasant explore however gameplay loop get little repetitive found taking lot breaks would regularly return breath wild atmosphere relaxing minimal music wild ambient nature noises music soft piano vast open spaces also appreciate added substance story granted nothing crazy provides welcome change pace beat gym leaders get badges become best provided past years graphics aren bad people make definitely aren impressive almost feel like weren able high quality graphics whether cartoon realistic would looked better degree artistic design maybe watercolor impressions anything really graphics damper sense exploration little bit overall fun see taking time play relaxing experience everything solid effort exceptional laid groundwork future sequels truly fantastic games definitely tell far exciting possible new generation pokémon could introduce probably one memorable pokémon experiences last years 
525,rock bottom expectations leaks honest ever plan playing buying watch anything nintendo pokémon put release date marketing terrible job selling given freak track record last decade shocked able pull pokémon fan last decade rough oras awesome sun moon good despite repeated playthroughs making sour lot everything else short trainwreck gen definition lazy repetition aside bringing everything laziest rerelease think time let games yet another unnecessary remake awful boring gen know bad sword shield despite dlcs slight bit justice bdsp finally showed lot fans much passion series lost falling flat faces trying remake best games remaster remake let get legends arceus fantastic breath fresh air needed years might recent bias wouldn mind didn make main series long time meant games like legends negatives first elephant room since got revealed god awful graphics say definitely touched quite bit since still looks plain bad like playing ps2 2022 yikes immersion breaking graphics billion dollar franchise inexcusable console given breath wild mario odyssey learn optimize games already reason every previous switch pokémon looks better one pop bad sometimes things spawn right behind front running around get annoying want catch rare pokémon giving slip also button layout really weird legends point almost hours still hitting wrong buttons trying open map open bag heal pokémon dodge also made hands cramp lot long play sessions please put patch change button layout braviary flying feature needs work accent button take back slowly landing huge open areas dumb think biggest flaw aside optimization lack voice acting awkward recent games never awkward legends truly needed many big story moments deserved text box annoying ass boom sound effect also much right catching pokémon completing pokédex never felt better never feel slow mainline games ever despite pokémon annoyances get least didn shell extra 2nd identical version pokémon didn put lol new boss battles incredible actually fighting pokémon foot swear fever dreams like kid feel like person didn black story returnal conditioned reflexes dodge effortlessly guess wide open areas distinct ton fun explore actually really loved wild areas sword shield knowing sleeve bravo wishing looked like 2022 story true pokémon fashion lowkey end always time actually felt something hurt stunned stakes story established whole time filled nostalgia feeling like kid impeccable line walk deserves lot praise talking thinking fills childlike joy gone long pokémon even got fair bit challenge new pretty good battle system woulda thought course lot positives small quirks didn jive 100 time legends arceus amazing foundation build sequels hopefully perfect formula end day damage previous games done love trust freak pokémon may never away done impossible giving hope franchise truly think turning point franchise hope full speed ahead never look back 
526,skeptical legends arceus leading launch nervous new formula would innovative unique would ultimately leave lot desired actually pleasantly surprised gamefreak delivered first created style vastly different previous titles maintained feel making sweeping changes overall gameplay loop pros fresh take formula action based gameplay sacrifices little terms staple mechanics good pokedex selection catching mechanic stokes envy lets games varying noticeable size differences makes catch much unique serviceable plot much streamlined competitive building requires fed certain items decent post content able summon order chill interact interesting options traversal new forms play decent economy encourages catching collecting items enraged huge fun capture cons multiplayer shame given fun single player content levels large whole lot see appeal open world wears towards end traversal mechanics unlocked graphics aren great enough trainer battles opinion new forms pretty ugly design wise decidueye except arcanine typhlosion opinion boss catching minigame could much fleshed wasn interesting felt bit tacked feel step right direction loads fun playing arceus genuinely thankful gamefreak shook formula immensely managed get many things right first try none cons listed stopped enjoying start finish far perfect experience experience gets excited future legends titles 
527,perfect starting pokèmon tries open man good work catching exploring without limitation fun reading hisui hidden lore quite fun problem comes try explore longer times graphic holds little manegable overall good really take time games 
528,overall pla great brings lot innovation huge understatement lively atmosphere plus good amount time someone play hours complete everything plus overall well polished haven seen reports major bugs glitches pokémon attacks look amazing however lot downsides newer pokémon designs thought longer general say someone likes around pokémon designs visuals bad obviously personally care would played ps5 story well would expect kid nothing groundbreaking offensive biggest arguably real complaint isn much gameplay variety simply battle catch certain amount pokémon use moves certain amount times boss battle attacking rather cool explained needs bit order keep invested also national dex small multi player nonexistent sounds like lot complaining trying clear possible flaws buy honestly depends person know sounds like cop truth want something breaks free pokémon formula matter yes buy one people complain endlessly breath wild empty think one people strict annoyed things think someone loves playing around pokémon surroundings yes love either way wouldn worry much whether made bad purchase still able fun 
529,good job freak pokémon deserves new formula works delivers even minor gameplay flaws missed opportunities graphics good customization options nice plot really great gameplay loop haven invested pokémon gameplay since solid 
530,best since n64 stadium titles huge step forward franchise plenty room improvement better animations cleaner visuals gameplay mechanics less grinding would make sequel legends arceus contender goty 
531,english pokémon legends arceus best pokémon since black white saying masterpiece lot asked premise gotcha succeeds search every corner cross sky sea everything pokémon always wanted beginning many moments gives feeling total freedom able almost corner shown map even complies everything perfect often mediocre controls good respond perfectly vibration gives touch braviary rough control difficult control times music quite good exploring even stop enjoy instant music fights time almost games regard coach music also repeated without changing times ends tiring story takes long time start ends capturing expectation knowing coming unfortunately ends suddenly never gives room unknowns much share hope helps deciding whether buy español pokémon legends arceus mejor juego pokémon desde black white digo que sea una obra maestra pero hace mucho que pedía este juego tiene como premisa gotcha consigue hay que buscar todos los rincones cruzar cielo mar todo para tenerlos todos siendo juego pokémon que siempre quisimos desde principio juego muchos momentos sensación total libertad pudiendo casi cualquier rincón que muestra mapa aunque cumple con todo perfecto siendo muchas veces mediocre los controles son muy buenos responden perfección vibración toque pero braviary tiene control tosco muy difícil controlar ocasiones música bastante buena hora explorar incluso tuve que parar para disfrutarla instante pero música las peleas misma todo tiempo casi todos los juegos son iguales ese sentido pero cuando música del entrenador tambien repetido sin cambiar mas veces termina cansando historia tarda mucho comenzar pero cuando hace termina capturándote con expectativa saber que viene pero lamentablemente termina muy repentinamente juego nunca lugar incógnitas esto todo que puedo compartir espero que ayude hora decidir comprar juego 
532,awesome perfect could better sure mainly grafics departement minutes tutorial dialogue boxes gameplay really shinies felling losing notion time playing playing breath wild good thing achieved 
533,best ive ever experienced defiantly taken inspiration breath wild listened fans sword shield joke ten minuets hated totally different isn enough hours day play grew watched series movies played blue gold crystal ruby unfortunately shield games something new iteration gold better progression system isn huge jump power levels like blue ruby probably tightest played shield came expecting arceus offering got rehash getting last years looks like early development proof concept poor need get high level talent nintendo bring next level look good moves look even better leaves confused environmental textures could hard lighting fine texture issue environment doesn really match style odd dont really sense cause kinda samey unless near waterfall beach something use kind landmark needs improvements close getting always wanted gameplay wise pretty good little issue gameplay still turn based share exp harder still pop pop ridiculous could chasing sudden pop goes away needs fixing early fine anymore lack point absence voice jarring still stuck text speech one biggest franchises world enough voice budget giving eight cause happy playing plenty issues really six nostalgia strong one 
534,love hope sword shield grafics bad mean made 200 whit new attack animation love exploration could details explore filling pokedex think right way goes hope games like one 
535,know complete standstill past years legends arceus come admit pleased expirence disapointed time hours belt say good iits great terrible good highly reccomend looking reviews filled people giving 10s also giving reccomend playing promise enjoy 
536,turn based rpg better switch almost entire look lifted breath wild pokémon completely blows games water improvements core gameplay vast extremely hard replay previous entries unfortunately freak amount innovation setting high bar things like voice acting dialogue trees going must sequels get away copy pasting entire 
537,considering freak track record recently really fun bit janky 
538,almost hours gameplay sincerely say enchanted put played continuously since bought free time filled seeing happened really low expectations saying going flop sure glad didn happened giving feel alot things could graphics goddammit needs bit polishing maybe cool minigames different mysteries wuests randomly find wild would amazing feel formula amazing potențial become almost perfect rpg anyway glad good bought maybe see dlc even cooler games future 
539,new missions associated every pokemón freedom explore open areas around intention find specific type pokémon distinguished species specifications catch pokemón witch important factor contributes research fun careful one aprouching environment around creatures art style menus one select pokemón witch first choice party always disposal new físicas pokedéx missions pokemón already mentioned overal layouts art choices good create feeling medieval era good way low points graphic questions lack cities locations elements doesn decreases enchantment 
540,almost hours loving battle mechanics great fact wild pokémon blood soon see hilarious terrifying downside graphics water especially overall breath fresh air franchise 
541,fun didn blow mind definitely laid groundwork future could doesn surpass experience playing gen games kid shake ups formula enough series feel fun first time decade visuals seem common complaint really see gamefreak never exactly masters aesthetic quality fine looks passable sometimes even pleasant roaming around village first couple hours reminded bit utawarerumono series main zones start become pretty drab didn make poor first impression terrain textures matter could made flat colors care mesh lod pop much bigger problem big things liked main gameplay loop fun going way fill pokedex earn new stars never got boring someone likes jrpgs tired encounters random otherwise new approach battles feels nice starting ending battles feels seamless battle isn going way quite literally turn around walk away love effort level system without drawbacks makes challenging system mainline games rewards sticking long term effectively giving massive stat modifiers main never felt invincible went way max els though feel kinda gamey compared evs especially process levelling nice actually able see numbers inventory moves swap four use whenever want like lot better way works mainline games item lets evolve would otherwise need trade evolve guy never really cared trading thing appreciated lot mounts cool others big problems quality life related switch zones without returning hub area first return village either get back camp first talk scientist guy goofy hat first every single time need somewhere village something leave second business complete walk fast travel gate first started get really annoying first hours would much better let jump zones freely map village slow get around usually faster open map fast travel building across street walk areas access mounts feel annoyingly spacious general pokebox well equivalent quickly becomes eyesore talk specific npcs access meaningful option automatically sort filter particular big problem ability seamlessly throw pokeballs wandering without encounters new pokedex research system new effort level system encouraged catch every lay eyes actually sorting catch makes process less laborious would one year old games sucks lot option skip cutscenes cinematic moments free skip boring conversations times throughout slowly click line uninteresting dialogue option shorten disable combat animations main boss fights zone pretty lame bosses uncool player role fight chuck 100 bean bags mounts vary quality less answer bicycle traversal hms previous games deer pretty great surf mount awesome sure highlight rest though lame expected flying one completely change interacted zones exploring point fly right awesome like aircraft gta clone pull pocket glider pretty much mean gliders aren bad cmon man massive letdown cool fish 
542,graphics good terms landscape basic gets nowadays necessarily bad subpar seen lowered framerate pokémon get get certain distance terms actual gameplay though really enjoyed core loop finding pokémon different task order get research point enjoyable sort get lost exploring finding pokémon find one corners area probably still missed things way despite graphics fun casual play could easily see someone playing long train ride car trip sort want portable system 
543,finally solid entry franchise stagnating last half decade generous swsh easily least favorite pkmn time bdsp extremely pointless retread old little way anything new compelling offer extremely skeptical pretty convinced would end mess curiosity ended getting better really say pretty thoroughly won ultimately comes gameplay actually quite compelling time around comes fact actually requires thought part player terribly difficult unforgiving anything isn mindlessly easy either might actually need think type match ups moves teach might even bit planning resource management strategy play imagine huh anyway real massive complaints quite fun mindless check bunch things list sort way even though definitely big shortcoming visuals never cared much graphics unfortunately say looks awful gamefreak needs staff visual department isn actively detrimental opinion definitely going people others aware 
544,hours look forward quite disappointed first hours minus opening dialogue gave goosebumps saw baked pokémon sprites fluctuating quality depending standing complete zelda botw rip less charm however get past slow start inconsistent graphics starts pick team gets stronger able less likely get destroyed wild backtrack see missed previously get used mechanics know navigate around actually pretty fun plenty side quests actually bit annoying overwhelming see trillion people asking things village bit want say moments really beautiful theme piano music starting undetected grass throw pokeball kadabra lol also combat pretty good quite visually appealing although bit derpy run middle battle anyways things considered definitely grown actually bit addictiveanyways quick review would say take opinion try make mind 
545,obvious developed enough one would like opinion good start new vision franchise capture realistic world see whole surface also need loading screens hope next installments seek use formula improve notably since obviously limps lot graphics feeling living world 
546,visuals graphic really bad always pokèmon right blame gamefreak main storyline bit lame doable get used graphic style especially first zone pokémon flying fps distance start get captured really enjoy fresh innovations new type gameplay 
547,one best pokémon since beginning long time since fun capturing pokémon seeing new one exploring map graphic wise could better since first open world hope future continue make like one upgrade graphic 
548,playing pokémon since platinum quite bit burn last couple games legends hold many ask let get big downside done first lack art direction personally mind lower graphics whole experience could stylized like mhst2 picked recently play nino kuni pretty old came playstation switch holds art direction second issue mostly abilities held items pokémon help differentiate pokémon battle like layers complexity specially turn based jrpgs past bad first say fun ever catching pokémon allows engage different ways stealth first option method choice getting bonus throwing ball back satisfying take pokémon head battle want pokémon run early run start battle back throwing pokémon behind fun stun filling dex thought gonna tedious fun gotta engage different aspects catch level research level said pokémon give berries find ones different weight size evolve defeat battle see perform moves also yes count use battle stealth catching also add research levels also exploring open zones finding pokémon great specially find rare encounter didn see first time going area pro tip heavy balls early friend gotta get close worth specially catching alpha pokémon give seed mastery use master move back town use heavy agile style said move great exp team good chunk money finally money need upgrading inventory size onto story characters without spoilers pretty good specially pokémon standards usual pokémon visually striking characters great personalities bad voice acting feels like next step pokémon tendency speed read without voice acting kinda forget little said fact overall think story probably best seen pokémon black white conclusion believe great ways engage catching filling pokédex technical limitations show heavily pokémon full life personality animated hopefully future kind games allowed time bake oven solid art direction story characters great still voice acting feels like would wonderfully series like adding charming characters overall continue formula older audiences win 
549,huge step foreward semi open world huge improvement graphics could better lack trainer battles one point critical even thought explained story therefore 10other positive improved fighting systems elite crafting need trading real people get like gengar pokedex system lot potential upcoming gamesnegative graphics outdated 2022 lack trainer battle 
550,perfect far mainly graphics greatest point disappointment would taken little longer polish alas look however since think best funniest pokémon since nintendo days also first long time truly play hours end day day hatching plan sneak strong pokémon really want fight still catch seeing plan work best thing ever even fail still something learn failure apply next time wild pokémon also feel stronger games huge plus makes really think team gonna bring going wild tltr even though perfect still fun super refreshing pokémon franchise excited see next 
551,enjoy much would traditional gripe really opening felt like took foreeeeeever actually start journey shovel dialogue cutscenes tasks needed advance felt repetitive world felt bit empty entire time playing imagining would like battle gym wandering kanto hoenn johto regions new engine hope think next canon 
552,definitely imperfect glitchy lots fun like battles bit difficult direction taking years 
553,overall good like new ideas like catching without enter combat quickly switching battle also like open world sections enjoyed playing story unfortunately limited hardware runs 
554,waiting day one pokémon fans back days red blue imagined world pokémon like open areas joyously yeet pokeballs mons overworld satisfying able linear path story still give lot freedom terms want build team gain experience research required complete first pokédex true blend fans desired think proves strongest franchise gameplay wise say artistic direction could used lot talent see botw switch launch title look way robust terms environment legends says gamefreak dire need fresh eyes lead next core titles well beefed switch enhance overall experience said still looking goty contender 
555,love made account give rating feels like heading right direction many good changes make experience much better new 
556,good story bad moments well done others example many bugs 
557,first didn finished yet idea absolutely loving finally good attack animations good plot interesting charachters lore think best part actual open world even graphic could better ambients fantastic love pokedex mechanic think real fun core however also found strange things made little confused already said graphics good big deal many useless praises main charachter sometimes feel little bit cringe tends little bit repetitive mechanics like finish boss obtain new level defeat another boss ect ect 
