,review
324,finally gamefreak put effort however actually work minor spoilers haven watched trailers warned first sitting sat hours straight giving honest put together fair review played stream said pros cons text others read decide want purchase put hours put together fair review overall yes worth impressed gamefreak took risk hope future games use type system things could done better first pokémon night could variety every map pokémon night except exclusive map night driffloons find annoying day variety map night lacking side quests need work need descriptive give maps name least give quest area name isn map someone would mentioned name remember map needs little towns immersivness people coming existing places town however never actually find towns instead random quests maps pick could little towns pick could learn little places operate time except hear places never get see shame pokémon wild could behaviour characteristics get close another pokémon could argue even fight bidoofs collecting wood make dams beatifly landing trees sucking nectar things give pokémon life sleep night despawn get replaced night pokémon happen great system open world style really suits huge step forwards franchise able choose try catch pokémon right away battle great even better able move battling doesn anything lets look around annoy one pokémon end battling many enemies around crafting actually lets something open world style collect materials find ground get rewards catching fainting might think tedious thing need craft smash content however crafting add little like type thing collecting recipes crafting new recipe make fights easier future mounts run fast break stuff swim fly switch whenever want pad currently running mount water automatically switch swimming mount great addition gamefreak well done however wish could actually fly around fight flying pokémon sky danger actually faint pokémon attacking could harder though easy dodge pokémon attacks get away however fear actually fainting loosing items went crafted bought cool addition alpha pokémon great addition litterally throw pokémon anywhere call back catch alpha pokémon compare size regular one choice either fight wild pokémon catch right bat even aggressive pokémon approached correct items caught alpha pokémon without battling side quests great flaws time side quests different styles quests little story around 5th side quests fill pokemons dex entry many opinion planning finish dex entries anyway want reward overall hard love gamefreak went risk put much effort new rather getting new 3ds slightly bigger map size great direction new pokémon games see botw series test see audience enjoy style future get immersive maps maps towns going end truly flawless continue direction use style spin games future 
325,say really enjoyable far hours breathtaking breath wild think could steppingstone next might revolutionize series freak right track give fun way graphic bad compare botw people way high expectations like expected botw level hell 
326,excited ever see catch zubat pokémon new gameplay loop addicting actual challenge catching pokémon staying alive con graphics buggy times mean expect oversized cell phone bottom line fun holding interest compared last mainline pokémon titles 
327,legends arceus amazing new direction series honestly thousand times better sword shield opinion sure enjoyed sword legends amazing feels like meets breath wild sort maybe meets monster hunter rise multiple massive open areas explore hunt things also much fun graphics look alright leagues better sword shield gameplay solid much like hoping saw original reveal trailer love kinda tough avoid getting wrecked high level alpha wander far would say least make save datas let sword shield brilliant diamond shining pearl free clothing items two bonus quests involving mythical postgame also fantastic favorite starter cyndaquil starter digress pick find good 
328,perfect man far best released ten years 
329,one first times captured wonder felt playing first young astounded many risks gamefreak finally taken genuinly hope type gets polished new template series moving forward however graphics fact pretty awful usually doesn mean anything personally somehow makes notice pop pretty anoying really understand games like breath wild launch title look way amazing due clever art style tricks make run flawlessly switch limited hardware assume success effort put aspects next arceus like unfortunately graphics hold back bit rather annoying graphic problems huge rework pokémon another bland mainline copy paste pokémon 
330,pros addictive well designed gameplay loops played pokémon allows curious encourages often feels rewarding exploring map adds many new quality life updates changes like battle mechanics expanded changes long overdue pokémon works really well games favor music amazing pleasing especially battles wandering around open world story time around surprisingly decent kept invested pokémon formula changed better really works games favor also actual pokémon actual personality refreshing see cons honestly really ugly looking times graphics par even switch lot jank controls takes away experience certain lack polish sure somewhat fixed release polish lack thereof definitely noticeableconclusion problems mentioned problem wish freak given perhaps months iron things even though didn happen pokémon legends arceus one well designed compelling pokémon games ever able overcome shortcomings pokémon fans waiting years first time years think future franchise looking bright 
331,worried graphics world lifeless empty simply much addictive gameplay loop either notice much care pokedex completion varied engaging completionists happily busy never looked better music phenomenal seamless transition open world battles engaging story graphical artifacts genuinely distracting times flickering pop ins glitching grass flat ruin moments 
332,start obvious downsides graphics good even considering switch looks unpolished unfinished story nothing special expect however enjoyed playing changes stale formula makes nice new experience new fighting options stale trainer fodder fights fun researcher action sequences give nice break normal monotone battles would given polished content satisfied 
333,best far enjoyed since years ago time really enjoy 
334,best ever played ever wanted growing perfect provides excellent stepping stone future games style hope gamefreak sticks style times painfully obvious devs first time attempting make like however gameplay absolutely addicting overworld simply cool pass 
335,amazing hope pokémon games continue direction future get lost hours world simply wandering around catching pokémon first time actually interested completing pokédex graphics let opinion 
336,never liked games tutorial would always remove bored technically pokémon legend arceus first pokémon enjoyed life played hours still long way really advance pokémon graphics leave lot desired doesn stop entertaining someone focused graphics buy fan games wanted change pokémon saga buy play promise won disappointed 
337,best pokémon long time cuts nauseating text boxes acknowledge previous games 
338,someone ever liked like someone literally cares graphics like 
339,fan amazing love music gameplay every body enjoy 
340,first genuinely enjoyed wanted finish since big fan monster hunter wonder love much sequel dlc new better textures would 
341,playing games since gen enjoyed every since legends arceus great video perhaps one best switch absolute best best per say first graphically looks fine games never visually impressive personally see whole lot difference graphically something like breath wild sounds great music sound track hits hard makes good use sound effects sometimes kind tell might listening helped lot much easier tell attack performance fine fps consistent fps personally prefer fps actually mind fps long consistent framerate good enough course though gameplay really matters fun addictive relaxing looking boss battles need bit work generally fun addictive whole lot free time due work stuff fact played hours last week says lot crafting system nice idea needs bit work really good lot resources gather good one two specific items seems like bit waste would nice think resources wanted use items resource different uses resources specifically certain types pokeballs resources specific certain types medicine etc gets point simply collect certain resources simply good use however really matters battling fun switching overworld battles never better think move pool lacking noticed lot moves seem taken ways helps balance battles makes difficult get right moves certain type coverage becomes difficult speaking variety needs lot work pokedex 250 smallest ever outside remakes sinnoh makes sense given story however bit disappointing see limited number type enviornment seem available every area many simply shouldn case know people complaints sword shield something really got right wild area sword shield disappointing see limited selection 400 500 size pokedex would make lot sense story good absolute best story ever gotten easily makes top real complaint much much handholding story games makes sense given linear games first place however makes lot less sense given open world enviornments really want explore enviornment almost seem force story upon instead like rewards pokedex completion completion gives insentive keep going games easily gives best rewards get money pokedex completion find continuing catch many get money get items clothes wish clothing options ones good also way shiny hunting options usual nice people enjoy sort thing legends arceus good looking pick first recommend sword shield first checking afterwards easily better sword shield better experience get see related stuff say games 100 percent must plays anyone interested legends arceus good groundwork future games certainly plan following see continue legends series think bit refinement generally taking everything bit farther well could future main line games excites 
342,little liberation offers fluidity play freedom movement good graphic performances agony impossible return episode would take gameplay speed old games scenario good role play researcher trainer logical agoal completing pokédex rating quite high fun appreciate initiative change good old whiskey served good old bidet hope legends would push higher finally use processor switch 
343,back better ever gameplay refreshing story needs work really problem solid evidence graphics measure good 
344,really amazing overall love new mechanics would amazing see implemented mainline pokémon games spin legends keep going said graphics aren par real shame could really done voice actors feel like something need invest going forward makes sheer amazing gameplay overall done amazing job 
345,played around hours far honestly say something unique special nintendo done yet take critic reviews pinch salt highlight technical aspects far much like many great nintendo games come performance quirks however get way many hours fun thoroughly recommend anyone switch even biggest fan great fun packed content great step forward nintendo thing ask dlc future games 
346,everything expecting delivered even true still sins questionable graphics performance gameplay good models monsters new animations really amazing story actually really good last part specially overall spectacular experience best since fifth gen looking foward see brings table mainline games gen could something incredible 
347,fun since first gen instead quests grinding pokedex hours without bored would graphics playstation level background like fps see right front shows gameplay graphic 
348,new experience pokémon amazing cant let playing exelent work nintendo 
349,hours finally finished fully completing pokédex facing fight legends arceus wild ride massive step forward series hope see going forward played every single since frlg grew series never felt emboldened since catching never easier yet still depth battles fun closer anime portrays world like full environmental storytelling looking characters recognise games little twists along way making use settings legends arceus also takes steps forward terms behind scenes mechanics think would good take forward future competitively also makes better casual players punishing hard beat legendaries rare spawns occasional pop sometimes models look bit slow distance real problem barring gameplay loop amazing scarily addictive absolutely recommend legends arceus anyone 
350,renewal pokémon made needed movement world expected things new unique mechanics launching ball mobility combat trainer many also combines perfectly action turns games graphics nice nintendo switch fit main history could longer one two señorial copies lots things dragon quest monters joker released japan advanced pokémon still one monsters development though pokémon needed way enjoyable could improve really masterpiece kind games 
351,despite graphical issues games days kid feel ever fun since gen last one actually bothered buy easily gonna take many hours beat love taking slowly filling tasks progressing story great chilling good time plus music characters designs great time around definitely give try care graphics play something xbox nobody cares 
352,pokémon always amazing time freak really tried innovate opinion worked problem bad graphics 
353,said except good job nintendo may perfect people one nicely done job one best years listen positive negative reviews fully recommend 
354,absolutely loved playing non stop past days say experienced enough give true heartfelt review legends arceus pokémon incredible refreshing new take tired old pokémon formula also streamlining many features originating older games stand alone however still good sing praise legends without taking graphical quality handheld mode graphics look perfectly fine people probably could get used within matter minutes however docked graphical issues made much apparent looking like something gamecube wii era short legends arceus great still fence highly recommend try sooner later 
355,someone minimal interest pokémon games point yeah real deal rough around edges somewhat poor graphics minor graphical glitches shines times decent character models pretty sunsets gameplay compulsive story pleasingly dark soundtrack better right impressed 
356,hadn much fun pokèmon long time loved lot great fluid gameplay loved new concepts included graphics need lot polish hope future games improve keep improve gameplay way 
357,best played since botw final boss epic love point graphics trash 
358,prettiest switch however far pokémon games far best kick franchise needed glued since launch battle system bit janky feel needs polish refreshing exploring every bit real estate touch still feel open world definitely needs little bit life much space lot going probably reading wondering giving even though thrown nothing negatives simply fun feel like fun hasn part pokémon love chased random aggro mons love fact actual story ability craft farm also nice touch able swap pokémon move fly great quality life feature say want step right direction plenty wrong plenty also done right hope see legends series continue amazing 
359,love step right direction fan love think people complaining graphics generally bit dramatic poorly optimized feel like needs tuning clip environment certain textures looking water shadows cause crazy pixelation everything around like horrible pixelation focus heart much heart literally breath wild meets little bit animal crossing crafting fire emblem garach mach monestary worth time money sure hell hope get another legends mew perhaps celebi 
360,everybody knows looks like man look gameplay amazing really fun great 
361,breath fresh air franchise far best switch 
362,easily fun playing yet love exploring world like almost new forms old think new really cool honestly story pretty good play loop different pretty fun makes catching fun isn really focused fighting collecting gym badges instead build first pokedex sounds like grueling easier make progress think feels good reach new ranks new areas ride fun use feel well integrated design environment speaking environment really good looking graphics look polished honestly one best looking games definitely one favorite series really complaint follow world sometimes trying get rank feel little tedious 
363,awesome brand new gameplay improvement great sound although graphic still good hope monimated goty award tga 2022 
364,addicted pokémon good since like gen fully recommend getting amazing much fun new mechanics great much fun 
365,freak delivered everything shown trailer boss battles fun amazed 4th one bit difficult expect graphics everything good music good makes forget graphics isn perfect good say one best gams 
366,better graphics new mecanics pokedex awesome wey pkmn follow 
367,best years fact makes purists mad shows affect whole franchise years come better experience whole due lack accessibility settings 
368,yes perfect world badly needs filling sincerely hope future pkmn games keep style revamp sorely needed would need happier multiplayer battles interesting content explore world 
369,jaded comes franchise simply gamefreak fed sub par overpriced games last years also contained design choices simply put baffling continous targeting younger younger audience made games feel like shallow fleshed mash adventures much trouble accepting legends arceus decent story right bat story akin gen5 one people talk actually dying mention get send earth god stakes often seem high throughout story like point bandit sisters snag growlithe rescue characters mostly fleshed sometimes like case male female counterpart player could done individual characters motivations behavior make sense dfficulty difficult easy opinion could habe bumped difficulty quite bit decent level difficulty mash credits pop makes far enjoyable especially way fight higher level alphas becomes lot challenging caught alpha ninetales mons around level gameplay hands biggest departure usual formula pretty good new fighting style different refreshing fact run around fights even get hit enemies attacks nice touch crafting fun side activity gives enough incentive collect stuff along way makes coherent experience love run higher level areas even fight mons felt extremely threatening run alpha snorlax level right start graphics yeah look clean honest attack animations also look decent oftentimes even straight amazing like hyper beam hydro pump blizzard terrain looks like intern blender grass looks worse mario cliff walls look like even glitch time time yeah graphics important thing world would expected ps2 graphics rest sidequests fun diverse yeah core often similar boring well games usually sells like arent makes feel less repetitive even one catch guaranteed shiny even get keep put balls jubilife even interact one another nuances never made implement lazy way makes feel much realistic way legends arceus good worth money get breath wild like feeling oftentimes run around anything main story quest 
370,graphics terrible wildly fun spite love everything updated catching 
371,looking negative reviews complaining graphics difficulty definitely difficult recent games difficult faint lose feel like unfair mostly fault graphics actually step compared pokémon sword shield although step aren great times sometimes see parts hills distance randomly load right front even sometimes tree pokémon rare occasions overall graphics give low every aspect phenomenal big step compared previous entries series rating truly great big step compared previous games especially comparing pokémon brilliant diamond shining pearl anyone thinks somehow worse bad games completely wrong gives amazing changes small changes may recognize first time playing tell put lot thought detail many different aspects problems far graphics nintendo switch optimization wonderful best time playing pokémon years 
372,huge step great direction cant fault time genuinely dont mind graphics find stylised granted frame rate far away low unsure issue switch hardware incredibly weak programing issue fun first foremost someone whos played every single ever release released breath fresh air come away old clunky boring system yes abilitys would preferred yes get competitive side weak frustrating people others want solid non competitive first time many years satisfys itch excited see company next hope god build system retire old one 
373,huge leap franchise fun good pokémon start good deservedly long tutorial long die hard fan pokémon franchise immediately notice fundamental changes made actually get good introduction new movement catching system someone way unbiased pick looks interesting good unlike many pokémon games sword shield actually depth story would let adults enjoy world pokémon wild people afraid even dare touch come prepared act rashly well lose life npc standpoint exaggeration say situation people hisui region facing tutorial doesn start yet saving professor life death situation choosing starter like graphically lot room improvement textures somewhat presentable playing handheld mode eases pain plug dock hook thing notice many rather unattractive aspects sadly offer already visual points attack animations crisp look good npc finally look like actual people added facial expressions less repetitive movements look sun moon bad example imo somewhat better dialogue general character designs creative stick memorable personalities nearly one sided used latest games even group thieves encounter couple hours gameplay explains steal order survive reasoning behind tasks conversations faced multiplayer even call minuscule would forget even thing would say actually adds immersion mostly alone open world levels would still gladly take improvement current solution picking players lost items slight reward trainer battles scarce way makes sense since shouldn many trainers around anyway speaking logically doesn lack fighting general since enough wild pokémon slight lack tiny bit competitiveness would get defeating elite four would like see options choose challenge certain npcs battle actually training ground village story wise maybe used couple times time played one battle real fighting interaction challenge someone music good sound design gotten better actually hear echo pokémons screams fighting ruins engaging gameplay new fundamentals stealthily sneaking pokémon order catch actual trainer vulnerability already mentioned things fun fun safe say level lore depth atmosphere gameplay design new standard franchise 
374,put aside feelings obvious graphical issues play loop mechanics feel legitimately great first ahead something big mechanics nailed gotta start working modern time line gyms frontier kinds open world environments smooth graphics spent hours getting lost trying discover different areas different different ways encounter approach 
375,games innovative gameplay loop really engaging world building lore exemplary ugly still epic scenery feels like huge step forward 
376,refreshing shift beloved franchise wait see take 
377,dont let dumb youtubers fool amazing rough draft future games 
378,great addictive fun graphics improved lot 
379,good concept behind core mechanics felt polished seems freak really homework even though technical limitations coupled blurry weird textures think still playable enjoyed lot 
380,room improvement made progress 
381,good start big change system made exciting worth playing anyone nintendo switch fan 
382,think neat perfect long shot however subjective fun shouldn necessarily pushed aside looks 
383,great really like world set games areas genuinely look really nice gameplay also quite fun also streamlined many aspects navigating hisui feels fresh quite enjoyable sure obvious downsides like graphics feels like lack proper lighting lackluster art direction artstyles world characters kind clash honest franchise needed something drastically new long time isn revolutionary thing ever exact series needs probably everyone either considering strictly single player experience completing pokedex never bothered previous games reason find addicting think people ought buy encourage freak yes need innovation care put future titles 
