,review
631,takes players extraordinary adventure ancient japanese themed world get chance befriend legendary arceus let hope everyone forgot conquest make sound original fair hate think great reimagining sinnoh remake wanted still pretty good time hesitate first discovering final sinnoh remake going spin really disappointed mean let catching mechanics vastly different compared games easy learn lot like original games everyone could learn reflect whole new world brand new catching mechanics altered battle system diverse battle system best really impressed new catching mechanics stalking careless tall grass like true hunter smashing back capture really satisfying definitely biggest strength definitely isn battle fans rather designed love complete pokedex world version exclusives trade items equivalent evolution stones nothing holding back time catch pocket monsters personally favorite part experience probably alpha remind old pokepark memories aren pissed want tear shreds exhilarating trying catch guys roar loud sends character flying added size glowing red eyes really adds intimidation looks lot like classic mystery dungeon box art gives another reason love leveled strong legendaries makes satisfying build team know awesome build team made alpha sinnoh starters like dream come true also shout reason call reimagined sinnoh listen carefully hear remixed level themes diamond pearl across eterna forest coronet works celestica flutes sound like old title screens plenty sinnoh set nice familiar tone like new forms fine puts greater smile face see hundreds sinnoh spread across land including platinum entries yes move half asked diamond pearl remakes done well part great even half broken controller sprite glitches still fun ride charm characters started wear defeated avalugg bet lot people question part back hell commander kamado kick village reason suddenly accuses child suffering amnesia nothing help team galaxy save nobles causing distortion threatening region hisui point lot scene story feel forced commander suddenly turns antagonist extra backstory charm sisters care boss fights annoying fan side quests nitpicks rpg doesn need breathtaking story good kamado motivation childish feels like writers made character antagonist first climax wasn exciting enough weak sword shield antagonist volo true villain ask anyone care final fight takes place main story credits players likely miss really built well sadly like new cynthia remakes developers make fight unnecessarily difficult order entertain older fans like difficult challenges really think battle system highlight starts feel smaller started climb mount coronet putting effort remake distortion world summit level longer huge missed opportunity listen sweet remix level one takes minute climb main gimmicks lot entertaining conclusions characters vibrant dit feels good build team favorite really needs something wants remembered hopefully dlc time around worth purchasing fun modern years hope gamefreak return greatness someday one step time 
632,underrating shouldn everyone e10 rating pending could harmful little children story like parental guidance gameplay like monster hunter world rise like open world zone frame rate enough adjust 60fps 1080p graphic similar sword shield however music open world area quests like much better like music calm peace relax brain without expressing anger believe enough strong graphic frame rate disappoint put low quality even though compared breath wild compare monster hunter world monster hunter rise hub system battle mechanic bad strong agile much combination confuse turns also moves small disappoint moves gone difficulty battling tricky everyone thing win higher level like post ending start without check point modeling doesn make sense like different colors confusing think shiny trade evolve yay fans think trade evolve would get stolen refuse give back impress add new items like linking cord returning quest money low rank progress slow progressing story also wasting poke balls catch limit amount waste buy think freak using graphic aaa technical issues rather finding good engine create also wasn much fun multiplayer 
633,nice compared last pokémon gamesa graphics poor improve lot way 
634,definitely step right direction however gamefreak needs build foundation need settlements interesting locations better told story voice acting maybe interactions world especially pros finally step forward franchise fun action centric boss battles catching feels great way better difficulty spike older gamescons horribly bad storytelling even handholding monster hunter world feels liveless interact eachother boring environments secrets ones discover story 
635,playing legends arceus fun freak finally tried something new improved gameplay make feel faster positive things right direction franchise hopefully bunch improvements find way main games good gameplay story direction cant ignore technical graphical problems called criticized art style problem looks really good find right camera angle look world legends arceus compare similar games worlds like monster hunter rise switch even exclusives like xenoblade snap upcoming kirby zelda botw many legends arceus looks awful steam pre alpha even n64 compare areas zelda ocarina time lot pop ups trees etc main town one houses copy paste awful environmental visuals lot areas feel empty also nearly points interests wants explore world course need next gen graphics realism look mind product big video company biggest franchise world generate millions dollars cant deliver visual standard fits size popularity franchise freak finances get help studios like every nowadays even halo horizon etc gets help many different studios console problem see way better looking exclusives switch lot crunch time company decision put games market high frequency essential content visuals get enough positive scores media games sold overall makes quite fun uses fresh optimized gameplay going another way main games decide want spend money looks like stucked past xbox360 ps3 era even point lower compared actual games feels like completely low effort product details soul end decision whether want support course company freak want see way bigger change biggest franchise world 
636,promising really worth full graphics poorly optimized still sword shield actually looks better promising change battle system exception trainer moving around thus taking multiplayer completely unnecessary dumbed 242 pokes region may upset alot trainers catching mechanic lacks potential cut middle man traditional lets stealth mechanic poor better catching foot battle story average story minor grim tales abilities natures longer thing evs ivs still despite competitive battles 
637,legends arceus expensive tech demo past several years transition sprite work models gamefreak made risky move turning console title shift come noticeable drop quality particularly department manages compatibility titles sword shield reduced pokedex rather sparse content legend arceus follows suit delivering really unique playstyle overshadowed generally devoid content ancient world sinnoh bland misses lot diverse biomes typically populate top generally feeling empty whole love probably still enjoy shake feeling released free demo team dedicating time fleshing world missions overall experience sure gamefreak looking cash grab grown plain lazy legend arceus hopefully set precedent paving way much better road 
638,good idea terrible execution pokémon tried innovate seems made absolute lack love franchise even though includes nice additions classics formula keeps repeating classic mistakes even going mention art direction graphic issues everybody seen still enjoyable experience though definitely best pokémon years even close extra points effort put trying innovate shouldn praise freak making feels unpolished sometimes even unfinished 
639,half baked price aaa feels like 2005 voices text cant jump cant pass terrain graphics horrible bad textures effort make art cant render proper graphics would expect 120fps switch graphics bad think barely pushing world lot pokemons thrown besides feels rather empty sense wonder exploring dull read good stuff people making going good direction better previous doesn make good 
640,love first hours play really fun interaction pokémon really good reaching later areas starts feel bit repetitive empty understand world supposed feel empty empty graphics good normally would mind feels unfinished hype got fact pokémon one biggest franchises nintendo kind disappointed higher expectations 
641,breath fresh air truly like direction going story decent controls nice pokémon seem bland previous pokémon titles fun fan series years ignore many inconsistencies npcs sometimes moving mouth talking sometimes uninspired landscapes caves specifically horrific graphics especially light shadow work lilac shimmer ground apparent reason framerate annoying repetitive dialogue pokémon glitching trees jokingly bad render distances multi billion dollar company year 2022 gameplay however really fun perfect fun really hope next legends improve things clearly lacks right great potential 
642,visuals improvement still bad 2022 play fun first gets repetitive catching trash pokémon 
643,breath fresh air players needed gamers content became repetitive great ideas let hope gen moving expanding expectations good 
644,step new exciting direction world feels eerily dead unfinished example severe lack music running around map stand around staring space instead playing chasing species kind spawn groups certain spots without much variation graphics rather poor finish main story hours like games easy cool things though especially open world aspect also fairly challenging events rare shiny catch quite legendaries catch enjoyed yeah something emptiness really puts 
645,let say good experiment battles mess little amount avoid almost battle want doesn make sense pokémon catch need train even bosses beaten without even using single pokémon joke wining experience even didn use battle system mess left much desired like enemy poisoned use calm mind buff next pokémon use agile style attack die poison another comes new uses quick attack new uses agile style attack new attacks turn finally calm mind effect expired joke understand held items abilities surely need improve future games also story bland postgame epic doesn makes much sense tutorial longest franchise get wrong liked catching exploring done better ever makes really fun play far best part rest meh 
646,really fun first due novelty got really boring really fast struggling stay awake time story bad let others tell otherwise backwashed horses semen bottom gutter story items annoying item storage even hope zones hopefully free patches could back time wouldn bought pokémon last one think pokémon anymore 
647,gets repetitive locks main story behind level grinding called legends little legendaries catching super fun battling broken fun fighting people feels abusive fight wild 
648,average running around world catching pokémon dream come true since little kid first time experienced pixelmon must say ugly horrendous textures lod pop ins landscape blur details ps2 era guessing budget went animations animations solid moves looks good pokémon idle alright models best story one nothing exciting like past pokémon games basic people rating perfect 100 100 insane ones giving average think honest review hopefully freak evolves step away past safe zones recommend buying playing 
649,fun first luster wears badly goes initially rated play see ugly visuals battling terrible style system horrible barely moves lots battles versus multiple potentially multiple turns even anything send die without even moving slow styles boss battles mess first couple fine 3rd start wonder designers thinking certain attacks basically impossible dodge goes idea simple spoiler example arcanine whole thing dashes across arena lava leave enough space dodge fine puts massive fire ring middle arena completely blocks anywhere dodge sideways tackles ring die mechanic makes sense feels frustrating cheap doesn require react dodge move way attacks point dodging tackle still like took fun complexity actual battles boss fights nightmare poorly designed attacks try dodge throwing balms also lot small irritating things like save file small satchel supposed constantly gathering things fun catching huge laundry list problems could ever get away like company series would dragged many issues outdated systems 
650,graphics anren good swear reused assets phantom hourglass sound ain good either music sounds like elevator music sound lack energy pacing extremely slow holds hand entire time far much text read gets boring quick much variety world alot depth combat aint much either character desings seeing moving around kinda cool 
651,graphics objectively terriblethere voice gruntingtons tons dialog cutscenesit really open world like sections open areasthe music uninspiredboss fights boringthe first hours trudgefeels like fan made gamegameplay loop alright crafting coolit tries mimic botw charm falls far short originality gameplay graphics music animation bugginess performance controls etc mean fan going get thinking getting probably disappoint 
652,mediocre get things right like seamless battles quality life comes changing movesets otherwise step back empty ugly world battles matter little since stealth throw ball everything even get one trainer battles offense based fun thanks new system good like catching nothing else point play much sacrificed like developed region towns ability battle others online 
653,gameplay boring throw pokeballs bosses orrible graphics even worse 
654,lazy reskin botw area low preforming grapichs bland overview really wanted like sloppy overall job taken one year polish world afraid releases done get great score reduced nostalgia worn 
655,non existent plot repetitive gameplay 2006 graphics thing throw balls 
656,compares monster hunter breathe wild doesn live expectations frame rate graphic makes look like solid ps3 hoping gets patches rating honestly fans would okay 
657,overall pokémon changes made exactly waiting years issues start realize though open world technically even less open world previous games straight stole world system monster hunter central hub filled npcs converse merchants crafting capabilities didn really even use recipes already example brown apricots preventing acquisition pokeballs love ball premier ball exploration zones wild area sword shield larger alpha pokémon permanent weaker versions dynamaxing nice really anything new supposed come special moves moves bought move trainer money money never thought pokémon would make money redundant wasted first million buying moves pokémon ended releasing back wild eventually recipes cost money costly upwards 000 far made million even quelled first noble need buy pokeballs potions upgraded versions cause craft bag space kind expensive awhile first upgrades never issue running space needing rest recover isn even anywhere close open world central hub separated loading screen every region regions travel without going back central hub walking buildings causes loading screens closed world wild pokémon spotting group something specific spawn larger numbers happens region time back central hub also things called time distortions summon evolution items stronger pokémon perfect level grinding coloured plates star dust crafted together star pieces spawn region time afterwards forced back central hub want spawn going back town also forced turn currently finished research gives money towards star rank star ranks purpose star pokémon levels would obey command even quelled kleavor equivalent gym badges previous games means time actually got mirelands every one pokémon collect one alpha form shiny forms hitting everything including noble mirelands miss fortune sisters trainers trainers trainers rushed unlock braviary stopping actually perfect dex like trainers fight handful leaders wardens diamond pearl clan even give balls pokémon people start real trainer encounter miss fortune sisters ambush time time follower like seriously yellow heartgold soulsilver lets best games follower pokémon stop removing feature combat evolved noticed love fact went way removed redundant moves harden condensed significant abilities like iron defense pokémon combat would perfect allow control pokémon battle combat like rpg instead turn based dodge block attack could easily done instead able run around combat trainer kind redundant little useless feature although yes say waiting years lower rating fact keep removing features series actually well attracted people spent 100 hours already perfect 115 242 available currently hopefully future updates dlc fix issues maybe try actually make open world claim one steal concept someone else 
658,predicted stupid director stupid unfortunately fanboys never admit think call gamers like lol predicted knew gamefreak going use timeline excuse add gyms trainers championship less directing needed nintendo fault sadly gamefreak owns part franchise 
659,okay gamefreak could better total content satisfying pokémon company 
660,would nice put budget use time time actually would first time ever freak actually utilized budget speechless way could start enjoy imagine kid affirmative anything related practically stuck 2000s appreciate know say garbage 
661,fun cking ugly jesus christ indiferent hate relationship progression 
662,solid baseline future lacks fundamentals features story graphics really terrible overall funny future chapter several improvement could think give better score today still 
663,honestly say really apreciate zelda way attitude freak need pratice graphics really good movement physics little inaccurate cannot swim little cannot check life stamina positive try make boss fight fun another way fight overall mediocre improvement old games past 
664,honestly overall bad graphics nintendo count many graphical errors ran however mechanics new battle styles honestly really cool lot fun battling although story seems pretty shallow super well thought nothing new honest overall think definitely worth playing worth price tag 
665,good step forward brand ridiculous quality gamefreak leave technical development third parties 
666,love pokémon playing years mainline games honest objective playing playing playing hours bad think good either main complaint battles completely ruined system place absolutely balance hate new styles never use pokémon battle attack twice something styles used sometimes even times abilities would help battles exist etc feel like battles complete mess wild pokémon battles proper battles trainers exist battles every years trainer uses freaking pokémon areas big imo bad thing extremely confusing sometimes annoying lose interest exploring everything different pokémon walking around know people love massive open areas cup tea like something middle crafting annoying way worse satchel limit pay ton money get spot item wtf won talk graphics know best didn really bother stuff worse mentioned way much talking nonsense talking way much find dumb one area back camp every single time request village request another area dumb waste time believe pulled change pokémon access objects store mandatory back camp much qol even get started losing ton objects pass absolutely miss battles real ones absolutely miss gyms marked objective pokémon league etc people may like type legends pokémon always battles gyms league pokémon master best play bored stop playing takes lot back doesn really hook force play least finish wasn free say love overworld pokémon possibility see shynies like battling send pokémon quick appreciate personally hope typical spin hurts admit way fun sword shield hope gen takes good mechanics like overworld quick battles etc focused typical gyms etc massive areas best pokémon everrrr people say hell even main essence franchise bad best either least give back competitive battles gyms would give 
667,took whole new direction different setting visuals much improved gameplay rather addictive truly feels like always exploring seeing wild 
668,ign italy review accurate critic review reviewer understands analyze systems interact one another instead mindlessly wowed open world genuine improvements traditional pokémon formula really improvements simply seem made without consideration whatsoever affect rest let start good non random seamless battles great want get fight wild pokémon toss one pokémon near bam battle loading screen battle transition effect instantly battle mode still free move around battle going see angle even get hit attacks careless stand feel like battling catch pokémon without battle great mind two main alterations freak made traditional formula good ideas unfortunately noticeably bad knock effects seems freak either didn notice compensated rather amateur ways previous pokémon games luxury hiding pokémon tall grass outside sword shield never actually showed wild means presence pokémon part player suspension disbelief totally behaviors listed pokédex never see legends arceus hand shows pokémon wild stand wander around bit live world homes behaviors interact one another simply exist wait caught fought much obvious visual fidelity issues makes world feel lifeless oddly empty battle catching speeds insane extent could catch everything without fighting would extremely quickly freak needed let happen large number people equate time spent money value seems freak implemented two solutions order prevent runtime drastically shortened first pokémon fall three categories friendly skittish aggressive friendly pokémon caught battle special requirements throw ball skittish pokémon caught battle long see first run away aggressive pokémon cannot caught outside battle whatsoever must fought captured traditional manner freak made pokémon aggressive made super convenient change formula set things force traditional formula anyway part secondly far damningly pokédex requires multiple catches multiple victorious battles multiple observations pokémon move use checklist items catch without seen dex entry specific pokémon complete really reason justification provided amounts repetitious busywork seems obvious another solution problem made playing faster convenient need keep playing roughly amount time catching faster require lot catches instead traditional one done battling controllable randomized require specific number battles pokémon player fight multiple times anyway worse virtually everything revolves around dex completion never gets interesting complex time sidequests ask complete dex entries outright things complete dex entries main quest also requires dex entries one note loop freak could done much interesting things good core changes make pokémon appear really live world require player observe record behaviors eat live use switch dex similar botw treated tablet actual device permit player directly record dex info perhaps fill blank fields selection pre written answer options dex central interesting things dex seem like brainer unfortunately freak settled make usual stuff way end result decidedly repetitive lackluster hope freak figures went wrong really isn hard see holes 
669,good graphics would goty doesnt get repetitive really nice 
670,open world like graphics one main features plays important role cannot must ignored title sold otherwise title technical scarcity nobody would bought let take fanboy mask let look well hand moves foundations renews titles fun intriguing etc want talk world square hills types trees copy paste whole map zero dungeons cross tunnels texture everywhere undriveable mounts camera leaves cabbages mountains change shape move away tall grass made strips rotate camera telecameraand could title find absurd offensive towards put effort love creating games 
671,one step ahead two behind could done little could new standard gameplay wise 
672,refreshing see open environments ridiculous people raving one worst looking games switch world bland empty shuffle around dont feel alive volume repetition catching lessens attachment team highest grossing video series ever deserve better people giving zelda mario released quality lack ambition would get terrible review new snap diamond pearl remakes bigger files shows lack attention detail arceus 
673,good pokémon fan made another company nobody would play gameplay interesting thing story poor tutorial never ends 
